train,stations
train_1,"[Den Helder, Alkmaar, Castricum, Beverwijk, Haarlem, Heemstede-Aerdenhout, Leiden Centraal, Den Haag Centraal]"
train_2,"[Dordrecht, Rotterdam Centraal, Schiedam Centrum, Delft, Den Haag Centraal, Gouda, Rotterdam Alexander]"
train_3,"[Alkmaar, Hoorn, Zaandam, Beverwijk, Haarlem, Amsterdam Sloterdijk, Amsterdam Zuid]"
train_4,"[Rotterdam Centraal, Rotterdam Alexander, Gouda, Alphen a/d Rijn, Leiden Centraal, Schiphol Airport, Amsterdam Zuid, Amsterdam Amstel, Amsterdam Centraal, Amsterdam Sloterdijk, Zaandam, Castricum]"
score,9193.0
